{
  "schema_version": "ocr-qa-run-v1",
  "qa_run_id": "ocr_qa_demo_v1",
  "run_kind": "corpus_gate",
  "run_status": "prepared",
  "protocol_version": "ocr_qa_protocol_demo_v1",
  "source_artifacts_manifest_path": "manifests/templates/demo/ocr_source_artifacts.jsonl",
  "source_artifacts_schema_id": "urn:ruphysbert:schema:artifacts:v1",
  "source_artifacts_manifest_sha256": "aaaaaaaaaaaaaaaaaaaaaaaaaaaaaaaaaaaaaaaaaaaaaaaaaaaaaaaaaaaaaaaa",
  "sample_frame_path": "manifests/templates/ocr_qa_frame.example.jsonl",
  "sample_frame_sha256": "bbbbbbbbbbbbbbbbbbbbbbbbbbbbbbbbbbbbbbbbbbbbbbbbbbbbbbbbbbbbbbbb",
  "candidate_manifest_path": "manifests/templates/ocr_qa_candidate.example.jsonl",
  "candidate_manifest_sha256": "abababababababababababababababababababababababababababababababab",
  "annotation_guide_path": "manifests/templates/demo/ocr_annotation_guide.md",
  "annotation_guide_sha256": "cccccccccccccccccccccccccccccccccccccccccccccccccccccccccccccccc",
  "code_commit": "0000000",
  "selection_plan": {
    "method": "stratified_random_with_manual_challenge_pages",
    "selection_seed": 20260901,
    "target_pdf_count": 30,
    "target_page_count": 100,
    "target_manual_challenge_page_count": 0,
    "minimum_prose_characters": 20000,
    "stratification_dimensions": [
      "source_id",
      "publication_year",
      "scan_quality",
      "layout"
    ],
    "strata": [
      {
        "stratum_id": "demo_source_two_column",
        "source_id": "source_demo_journal_site",
        "source_group_id": "source_demo_journal",
        "year_from": 2025,
        "year_to": 2025,
        "scan_quality": "born_digital",
        "layout": "two_column",
        "target_pages": 100,
        "minimum_prose_characters": 20000
      }
    ]
  },
  "variants": [
    {
      "variant_id": "variant_demo_a_v1",
      "extraction_method": "pdf_ocr_layout",
      "extraction_version": "ocr_demo_a_v1",
      "ocr_method": "tesseract",
      "ocr_version": "5.5.3-demo",
      "tessdata_version": "tessdata_demo_2025",
      "language_data_versions": [
        {"language": "rus", "version": "traineddata_demo_rus_v1"}
      ],
      "configuration_path": "manifests/templates/demo/config/variant_demo_a_v1.json",
      "configuration_sha256": "dddddddddddddddddddddddddddddddddddddddddddddddddddddddddddddddd",
      "parameters": {
        "ocr_dpi": 200,
        "page_segmentation_mode": 6,
        "layout_scan_dpi": 150,
        "column_gutter_pt": 14,
        "column_split_ratio": 0.5,
        "split_margin_pt": 10,
        "minimum_header_pt": 50
      }
    },
    {
      "variant_id": "variant_demo_b_v1",
      "extraction_method": "pdf_ocr_layout",
      "extraction_version": "ocr_demo_b_v1",
      "ocr_method": "tesseract",
      "ocr_version": "5.5.3-demo",
      "tessdata_version": "tessdata_demo_2025",
      "language_data_versions": [
        {"language": "rus", "version": "traineddata_demo_rus_v1"},
        {"language": "eng", "version": "traineddata_demo_eng_v1"}
      ],
      "configuration_path": "manifests/templates/demo/config/variant_demo_b_v1.json",
      "configuration_sha256": "eeeeeeeeeeeeeeeeeeeeeeeeeeeeeeeeeeeeeeeeeeeeeeeeeeeeeeeeeeeeeeee",
      "parameters": {
        "ocr_dpi": 250,
        "page_segmentation_mode": 6,
        "layout_scan_dpi": 150,
        "column_gutter_pt": 14,
        "column_split_ratio": 0.5,
        "split_margin_pt": 10,
        "minimum_header_pt": 50
      }
    }
  ],
  "comparison_plan": {
    "text_serialization": "utf8-nfc-lf-v1",
    "prose_normalization_version": "ocr_prose_normalization_demo_v1",
    "metric_version": "ocr_metrics_demo_v1",
    "cer_unit": "unicode_code_point",
    "wer_tokenization": "whitespace_after_normalization",
    "excluded_from_prose_metrics": [
      "bibliography",
      "formula",
      "non_russian_text",
      "table",
      "figure_caption"
    ]
  },
  "confidence_interval_plan": {
    "method": "hierarchical_cluster_bootstrap",
    "confidence_level": 0.95,
    "side": "one_sided",
    "cluster_units": ["work_id", "page_sample_id"],
    "replicates": 10000,
    "bootstrap_seed": 20260902,
    "quantile_method": "percentile"
  },
  "acceptance_thresholds": {
    "maximum_cer_upper_bound": 0.03,
    "maximum_wer_upper_bound": 0.1,
    "maximum_critical_reading_order_rate_upper_bound": 0.05,
    "minimum_formula_detection_f1_lower_bound": 0.9,
    "maximum_critical_formula_damage_rate_upper_bound": 0.05,
    "minimum_group_pages": 10,
    "minimum_group_prose_characters": 2000,
    "minimum_formula_occurrences": 200,
    "minimum_formula_work_ids": 30
  },
  "review_plan": {
    "reviewer_ids": ["reviewer_demo_01"],
    "gold_verification_required": true,
    "variant_labels_blinded": true,
    "reviewer_materials_exclude_variant_configuration": true
  },
  "supersedes_run_id": null,
  "created_at": "2026-09-01T12:00:00+03:00"
}
